Id,Candidato,Temas tratados,Descripción,Entrevista
1,Henry Cucalón,Propuestas de gobierno y visión para el país,Henry Cucalón es el candidato del movimiento Construye. En su entrevista abordó sus propuestas de gobierno y su visión para el futuro de Ecuador.,https://www.youtube.com/watch?v=gpn9gksBsuU
2,Wilson Enrique Gómez,Plan de trabajo y objetivos políticos,Wilson Enrique Gómez es el candidato del movimiento SUMA. Durante su entrevista discutió su plan de trabajo y los objetivos que busca alcanzar en su posible administración.,https://www.youtube.com/watch?v=i4HWMFPBoxc
3,Daniel Noboa,Seguridad, eficiencia del Estado y empleo Daniel Noboa actual presidente y candidato a la reelección ha implementado estados de emergencia para combatir el crimen resultando en una reducción del 19% en muertes violentas en 2024. Su campaña se centra en la seguridad y la eficiencia del Estado.,https://elpais.com/america/2025-01-21/la-indecision-entre-los-electores-continua-despues-del-primer-debate-presidencial-en-ecuador.html
4,Luisa González,Restauración de programas de gasto de la era Correa,Luisa González es la candidata del partido Revolución Ciudadana fundado por el expresidente Rafael Correa. Su campaña propone restaurar programas de gasto social implementados durante el gobierno de Correa.,https://www.reuters.com/world/americas/ecuador-ex-president-correas-party-taps-luisa-gonzalez-presidential-candidate-2024-08-10/
5,Andrea González,Propuestas ambientales y sociales,Andrea González es la candidata del Partido Sociedad Patriótica. En su campaña ha destacado la importancia de políticas ambientales y sociales para el desarrollo sostenible de Ecuador.,https://en.wikipedia.org/wiki/2025_Ecuadorian_general_election
6,Carlos Rabascall,Desarrollo económico y justicia social,Carlos Rabascall es el candidato de la Izquierda Democrática. Su plataforma se centra en promover el desarrollo económico con equidad y fortalecer la justicia social en el país.,https://en.wikipedia.org/wiki/2025_Ecuadorian_general_election
7,Francesco Tabacchi,Seguridad y empleo,Francesco Tabacchi es el candidato del movimiento CREO. Durante su campaña ha enfatizado la necesidad de mejorar la seguridad y generar empleo para los ecuatorianos.,https://en.wikipedia.org/wiki/2025_Ecuadorian_general_election
8,Wilson Gómez,Plan de trabajo y objetivos políticos,Wilson Gómez es el candidato del movimiento SUMA. En su entrevista detalló su plan de trabajo y los objetivos que busca alcanzar en su posible administración.,https://www.youtube.com/watch?v=i4HWMFPBoxc
